<?xml version="1.0" encoding="UTF-8"?>
<languageExamples xmlns:xsi="http://www.w3.org/2001/XMLSchema-instance"
			xsi:noNamespaceSchemaLocation="questionsToClient.xsd">
	<!-- send all necessary information -->
	<example>
		<sentence>
			<original>
			Peter wusch die Füße seines Sohns.
			</original>
			<english>
			Paul washed his son’s feet.
			</english>
		</sentence>
		<answers>
			<correct>
			German
			</correct>
			<wrong>
			English
			</wrong>
			<wrong>
			Finnish
			</wrong>
			<wrong>
			Polish
			</wrong>
		</answers>

		<!-- extra information -->
		<officialLanguageOf>
		Germany
		</officialLanguageOf>
		<officialLanguageOf>
		Liechtenstein
		</officialLanguageOf>
	</example>
	<example>
		<sentence>
			<original>
			Peter wusch die Füße seines Sohns.
			</original>
			<english>
			Paul washed his son’s feet.
			</english>
		</sentence>
		<answers>
			<correct>
			German
			</correct>
			<wrong>
			English
			</wrong>
			<wrong>
			Finnish
			</wrong>
			<wrong>
			Polish
			</wrong>
		</answers>

		<!-- extra information -->
		<officialLanguageOf>
		Germany
		</officialLanguageOf>
		<officialLanguageOf>
		Liechtenstein
		</officialLanguageOf>
	</example>
</languageExamples>